{
  "$schema": "https://json-schema.org/draft/2020-12/schema",
  "$id": "urn:udl-content-spec:v1:material",
  "title": "Material 教材",
  "description": "給學生「學」的東西：課文朗讀頁、簡化版、數學情境示範、角色對話。由朗讀器、RPG 對話框或獨立執行器呈現。",
  "type": "object",
  "required": [
    "format_version",
    "id",
    "unit",
    "kind",
    "title",
    "blocks"
  ],
  "properties": {
    "format_version": {
      "const": 1
    },
    "id": {
      "$ref": "urn:udl-content-spec:v1:common#/$defs/id"
    },
    "unit": {
      "$ref": "urn:udl-content-spec:v1:common#/$defs/id"
    },
    "kind": {
      "type": "string",
      "enum": [
        "lesson",
        "simplified",
        "demo",
        "dialogue",
        "mindmap",
        "rhetoric"
      ],
      "description": "lesson 原文；simplified 簡化版；demo 情境示範（數學等）；dialogue 角色對話腳本；mindmap 心智圖（只有 mindmap 區塊）；rhetoric 修辭例句（rhetoric 區塊，#51）。"
    },
    "title": {
      "$ref": "urn:udl-content-spec:v1:common#/$defs/spoken_text"
    },
    "estimated_minutes": {
      "type": "integer",
      "minimum": 1
    },
    "ladder_ids": {
      "type": "array",
      "items": {
        "$ref": "urn:udl-content-spec:v1:common#/$defs/ladder_id"
      },
      "uniqueItems": true
    },
    "curriculum_codes": {
      "type": "array",
      "items": {
        "$ref": "urn:udl-content-spec:v1:common#/$defs/curriculum_code"
      },
      "uniqueItems": true
    },
    "zhuyin_map": {
      "type": "object",
      "description": "逐字注音表（沿朗讀器 zhuyin.json）：鍵為單一漢字（一個 code point），值為注音符號字串。",
      "propertyNames": {
        "minLength": 1,
        "maxLength": 1
      },
      "additionalProperties": {
        "type": "string",
        "minLength": 1
      }
    },
    "vocab": {
      "type": "object",
      "description": "詞語／生字卡：鍵為 text 內 【詞|key】 標記的 key。",
      "propertyNames": {
        "pattern": "^[a-z0-9][a-z0-9-]{0,63}$"
      },
      "additionalProperties": {
        "type": "object",
        "required": [
          "word",
          "meaning"
        ],
        "properties": {
          "word": {
            "type": "string",
            "minLength": 1
          },
          "zhuyin": {
            "type": "string"
          },
          "meaning": {
            "$ref": "urn:udl-content-spec:v1:common#/$defs/spoken_text"
          },
          "example": {
            "$ref": "urn:udl-content-spec:v1:common#/$defs/spoken_text"
          }
        },
        "additionalProperties": false
      }
    },
    "blocks": {
      "type": "array",
      "minItems": 1,
      "items": {
        "$ref": "#/$defs/block"
      }
    }
  },
  "additionalProperties": false,
  "$defs": {
    "block": {
      "type": "object",
      "required": [
        "type"
      ],
      "properties": {
        "type": {
          "type": "string",
          "enum": [
            "text",
            "image",
            "audio",
            "dialogue",
            "math-demo",
            "check",
            "mindmap",
            "rhetoric"
          ]
        }
      },
      "oneOf": [
        {
          "type": "object",
          "properties": {
            "type": {
              "const": "text"
            },
            "content": {
              "$ref": "urn:udl-content-spec:v1:common#/$defs/spoken_text",
              "description": "text 可含 【詞|key】 標記，key 須在 vocab。"
            },
            "zhuyin": {
              "type": "string",
              "enum": [
                "auto",
                "none"
              ],
              "default": "auto"
            },
            "gist": {
              "$ref": "urn:udl-content-spec:v1:common#/$defs/spoken_text",
              "description": "這一段的段落大意（給學生的白話一句，#51）；lesson 教材的段落有填，就能出「這段在說什麼」與段落排序題。"
            }
          },
          "required": [
            "type",
            "content"
          ],
          "additionalProperties": false
        },
        {
          "type": "object",
          "properties": {
            "type": {
              "const": "image"
            },
            "src": {
              "$ref": "urn:udl-content-spec:v1:common#/$defs/relative_path"
            },
            "alt": {
              "type": "string",
              "minLength": 1
            },
            "caption": {
              "$ref": "urn:udl-content-spec:v1:common#/$defs/spoken_text"
            }
          },
          "required": [
            "type",
            "src",
            "alt"
          ],
          "additionalProperties": false
        },
        {
          "type": "object",
          "properties": {
            "type": {
              "const": "audio"
            },
            "src": {
              "$ref": "urn:udl-content-spec:v1:common#/$defs/relative_path"
            },
            "transcript": {
              "$ref": "urn:udl-content-spec:v1:common#/$defs/spoken_text"
            }
          },
          "required": [
            "type",
            "src"
          ],
          "additionalProperties": false
        },
        {
          "type": "object",
          "properties": {
            "type": {
              "const": "dialogue"
            },
            "lines": {
              "type": "array",
              "minItems": 1,
              "items": {
                "type": "object",
                "required": [
                  "speaker",
                  "line"
                ],
                "properties": {
                  "speaker": {
                    "type": "string",
                    "minLength": 1,
                    "description": "角色 id 或名稱；殼決定頭像與位置。"
                  },
                  "line": {
                    "$ref": "urn:udl-content-spec:v1:common#/$defs/spoken_text"
                  }
                },
                "additionalProperties": false
              }
            }
          },
          "required": [
            "type",
            "lines"
          ],
          "additionalProperties": false
        },
        {
          "type": "object",
          "properties": {
            "type": {
              "const": "math-demo"
            },
            "steps": {
              "type": "array",
              "minItems": 1,
              "items": {
                "type": "object",
                "required": [
                  "text"
                ],
                "properties": {
                  "text": {
                    "$ref": "urn:udl-content-spec:v1:common#/$defs/spoken_text"
                  },
                  "expression": {
                    "type": "string",
                    "description": "顯示用算式，例如 23 + 19 = 42。"
                  },
                  "image": {
                    "$ref": "urn:udl-content-spec:v1:common#/$defs/relative_path"
                  }
                },
                "additionalProperties": false
              }
            }
          },
          "required": [
            "type",
            "steps"
          ],
          "additionalProperties": false
        },
        {
          "type": "object",
          "properties": {
            "type": {
              "const": "check"
            },
            "item": {
              "$ref": "urn:udl-content-spec:v1:common#/$defs/id",
              "description": "提取練習：引用同單元的 item。"
            }
          },
          "required": [
            "type",
            "item"
          ],
          "additionalProperties": false
        },
        {
          "type": "object",
          "properties": {
            "type": {
              "const": "mindmap"
            },
            "root": {
              "$ref": "#/$defs/mindmap_node"
            }
          },
          "required": [
            "type",
            "root"
          ],
          "additionalProperties": false
        },
        {
          "type": "object",
          "description": "修辭例句（#51）：一句例句、用了哪些修辭（第一個是主要的）、給學生的說明。修辭題從這裡出：這句用了哪一種修辭、把句子分到修辭類型。",
          "properties": {
            "type": {
              "const": "rhetoric"
            },
            "text": {
              "$ref": "urn:udl-content-spec:v1:common#/$defs/spoken_text"
            },
            "devices": {
              "type": "array",
              "minItems": 1,
              "maxItems": 3,
              "uniqueItems": true,
              "items": {
                "$ref": "#/$defs/rhetoric_device"
              }
            },
            "note": {
              "$ref": "urn:udl-content-spec:v1:common#/$defs/spoken_text",
              "description": "為什麼是這種修辭（白話），答對後給學生看。"
            }
          },
          "required": [
            "type",
            "text",
            "devices"
          ],
          "additionalProperties": false
        }
      ]
    },
    "mindmap_node": {
      "type": "object",
      "description": "心智圖節點：label 是枝幹名稱（例如「天氣」），text 是內容；renderer 一次展開一層。",
      "required": [
        "text"
      ],
      "properties": {
        "label": {
          "type": "string",
          "minLength": 1,
          "maxLength": 8
        },
        "text": {
          "$ref": "urn:udl-content-spec:v1:common#/$defs/spoken_text"
        },
        "children": {
          "type": "array",
          "maxItems": 8,
          "items": {
            "$ref": "#/$defs/mindmap_node"
          }
        },
        "ordered": {
          "type": "boolean",
          "description": "children 有先後順序（例如做事的步驟、故事的經過）；有標才出排序題（#51）。"
        }
      },
      "additionalProperties": false
    },
    "rhetoric_device": {
      "type": "string",
      "enum": [
        "simile",
        "personification",
        "hyperbole",
        "repetition",
        "parallelism",
        "rhetorical-question",
        "quotation",
        "sensory",
        "contrast",
        "antithesis",
        "climax",
        "anadiplosis",
        "exclamation"
      ],
      "description": "修辭類型（#51）：simile 譬喻、personification 擬人、hyperbole 誇飾、repetition 類疊、parallelism 排比、rhetorical-question 設問、quotation 引用、sensory 摹寫、contrast 映襯、antithesis 對偶、climax 層遞、anadiplosis 頂真、exclamation 感嘆。中文名與說明在 activities/ 的 rhetoricDevices。"
    }
  }
}
